<!ELEMENT menu (cibo)*>

<!ELEMENT cibo (nome, descrizione?, prezzo+, calorie)>
<!ATTLIST cibo id ID #REQUIRED>

<!ELEMENT nome (#PCDATA)>

<!ELEMENT descrizione (#PCDATA)>

<!ELEMENT prezzo (#PCDATA)>
<!ATTLIST prezzo valuta (EUR|RUB|USD) #REQUIRED>

<!ELEMENT calorie (#PCDATA)>
<!ATTLIST calorie unitÃ _misura (Kcal|cal) #REQUIRED>